 User id,Name,Country
1,Jakayla Mosciski MD, United States
2,Alison Lemke IV, United States
3,Virginie Gerlach, United States
4,Carolyn Champlin, United States
5,Anastasia Larkin, United States
6,Maximilian Bosco, United States
7,Gertrude Schmitt III, United States
8,Jade Effertz IV, United States
9,Monserrate Schulist, United States
10,Agustina Hermiston, United States
11,Cleveland Green, United States
12,Janis Bayer, United States
13,Osborne Erdman, United States
14,Mrs. Arch Maggio, United States
15,Jerod Abshire Jr., United States
16,Julie Waelchi, United States
17,Asha Rempel, United States
18,Graciela Konopelski, United States
19,Alessandra Runolfsson Sr., United States
20,Brook Aufderhar, United States
21,Estevan Bartell, United States
22,Zoe Schinner III, United States
23,Lexi Donnelly, United States
24,Madalyn Eichmann, United States
25,Annabell Kuhlman, United States
26,Alphonso Ratke, United States
27,Greyson Okuneva, United States
28,Aditya Ankunding, United States
29,Kaden Fritsch, United States
30,Aliya Medhurst,USA
31,Dr. Jaclyn Pacocha, United States
32,Wilfrid Zboncak, United States
33,Nathan Gislason, United States
34,Faye Fadel, United States
35,Dessie Rohan,USA
36,Jeanette Stroman, United States
37,Mr. Alphonso Medhurst, United States
38,Kaylah Carter, United States
39,Eldon Connelly, United States
40,Aaliyah Bartell II, United States
41,Payton Maggio, United States
42,Clara Bartoletti, United States
43,Damien Anderson, United States
44,Timothy Konopelski,USA
45,Webster Nolan, United States
46,Claudia O'Connell V, United States
47,Kaitlyn Bechtelar IV, United States
48,Elwin O'Reilly, United States
49,Ofelia Shields, United States
50,Concepcion Koepp, United States
51,Paul Roberts, United States
52,Coy Cremin,USA
53,Mr. Stacy Larson, United States
54,Jettie Senger, United States
55,Ryder Borer, United States
56,Addie Morar, United States
57,Greta Hintz, United States
58,Adrian Pouros, United States
59,Wallace Donnelly,USA
60,Brent Watsica, United States
61,Eunice Mohr, United States
62,Ardella Muller DVM, United States
63,Gregg Russel, United States
64,Darian Schmitt, United States
65,Amari Predovic DDS, United States
66,Harmon Gusikowski, United States
67,Verdie Mertz,USA
68,Audra Dibbert IV, United States
69,Chesley Auer, United States
70,Miss Timothy Boyer, United States
71,Marcos Quitzon, United States
72,Jean Koelpin, United States
73,Alia Morar, United States
74,Jaylan Jacobi, United States
75,Camron Emard Sr., United States
76,Jettie Harber, United States
77,Donna Bosco, United States
78,Cordelia Hane, United States
79,Alena White, United States
80,Miss Eleanore Schmidt, United States
81,Lenora Fritsch, United States
82,Anjali Kshlerin, United States
83,Terence Pagac, United States
84,Miss Lolita Moore, United States
85,Richard Torp, United States
86,Monserrate Block, United States
87,Mercedes Maggio, United States
88,Kara Morar, United States
89,Hanna Labadie, United States
90,Bridget Rau, United States
91,Barry Schoen,USA
92,Tremaine Rippin, United States
93,Raina Collins, United States
94,Rudolph Oberbrunner, United States
95,Tina Haag, United States
96,Trenton Stehr, United States
97,Nicola Gulgowski,USA
98,Antonietta Cruickshank,USA
99,Godfrey Conn,USA
100,Addie Schumm,USA
,Pauline Strosin, United States
,Lacy McGlynn, United States
,Armani Zulauf, United States
,Cyril Mosciski, United States
,Brian Gerhold, United States
,Una Denesik, United States
,Earnest Gottlieb, United States
,Tanner Senger, United States
,River Effertz MD, United States
,Evelyn Spinka, United States
,Lenny Mertz PhD, United States
,Miss Kobe Conn, United States
,Albert Stoltenberg, United States
,Lewis Will, United States
,Michale Greenholt, United States
,Edwardo Huel, United States
,Mack White, United States
,Miss Owen White, United States
,Wilfred Romaguera, United States
,Gideon Prohaska MD, United States
,Faye Kohler IV, United States
,Ima Boyle, United States
,Henriette Padberg, United States
,Ms. Candice Kutch, United States
,Annamarie Torphy, United States
,Melody Bergstrom, United States
,Terrill Schimmel, United States
,Wilfredo Altenwerth MD, United States
,Cristobal Brown, United States
,Everett Stroman, United States
,Mrs. Kelsie Dibbert, United States
,Meggie Boyer, United States
,Abby Renner, United States
,Burnice Lakin, United States
,Ebony Ward, United States
,Miss Rowan Christiansen, United States
,Claudia O'Connell V, United States
,Sanford Ziemann, United States
,Mr. Kip Larson, United States
,Alexane Bruen Sr., United States
,Minerva Crooks V, United States
,Mrs. Xzavier Stark, United States
,Ms. Holden Schultz, United States
,Kelly Rempel, United States
,Harmon Mertz, United States
,Ford Feeney MD, United States
,Darrin Nolan, United States
,Nathen Hagenes, United States
,Bell Walsh, United States
,Braxton Bergnaum, United States
,Dino Bergstrom, United States
,Aaron Moen, United States
,Avis Morissette, United States
,Madilyn Parisian III, United States
,Brenna Beier,USA
,Jane Prosacco,USA
,Annabell Murray, United States
,Dr. Roman Gerhold, United States
,Chadrick Schultz V, United States
,Maxime Parisian, United States
,Jettie Rice, United States
,Judah Kling, United States
,Carmel Mayer, United States
,Brett Conn, United States
,Donny Marquardt, United States
,Jerome Langosh, United States
,Megane Russel, United States
,Krystina Doyle, United States
,Mrs. Shannon Bogisich, United States
,Keira Kautzer, United States
,Sophia Swift, United States
,Ali Boyle, United States
,Terrell Ferry, United States
,Raoul Armstrong, United States
,Mitchel Rowe, United States
,Matilda Marvin, United States
,Evan Corwin, United States
,Lou Walker, United States
,Leora Hayes, United States
,Lynn Schmitt, United States
,Eldridge Huels, United States
,Mrs. Antwon Gusikowski, United States
,Christiana Jenkins, United States
,Gerardo Wolf, United States
,Clotilde King, United States
,Reba Weimann,USA
,Ms. Norene Mills, United States
,Joel Armstrong II, United States
,Ursula Lemke, United States
,Bert Wisoky IV, United States
,Geo Kub,USA
,Hope King, United States
,Natasha Jacobi, United States
,Neal Wehner, United States
,Dr. Kayley Jenkins, United States
,Dr. Leola Schultz, United States
,Mya Trantow, United States
,Tressie Becker, United States
,Tristian Senger, United States
,Mr. Brisa Parker,USA
,Newell Homenick, United States
,Carleton Hand, United States
,Moshe Haag MD, United States
,Sidney Tremblay, United States
,Ms. Jerry Smith, United States
,Eli Mraz I, United States
,Werner Bartoletti, United States
,Albert Gibson,USA
,Dedric O'Connell, United States
,Santa Kassulke, United States
,Denis Hammes, United States
,Kariane Bode, United States
,Violette Kozey, United States
,Richmond Steuber PhD, United States
,Bryon Lemke,USA
,Prudence Boyer, United States
,Edythe Nienow, United States
,Eriberto O'Hara, United States
,Mr. Lonzo Kilback, United States
,Kara Davis, United States
,Reva Hilll DVM, United States
,Jacklyn Littel, United States
,Reagan Torphy,USA
,Genevieve Quitzon, United States
,Dwight Hand, United States
,Bethel Christiansen, United States
,Holly Keebler, United States
,Mr. Esteban Swaniawski, United States
,Fay Will, United States
,Presley Cronin, United States
,Kade Carroll, United States
,Mrs. Lilian Bergstrom, United States
,Sarina Casper II, United States
,Kenny White, United States
,Michelle Farrell, United States
,Angelina Beier, United States
,Domenic Littel, United States
,Mekhi Donnelly III, United States
,Ethelyn Moen, United States
,Alanis Larkin, United States
,Zack Nitzsche, United States
,Zaria Rath, United States
,Mrs. Brady Wolf, United States
,Keely Koepp, United States
,Vernon Douglas, United States
,Titus Schuster, United States
,Brody Wiegand,USA
,Dewitt Lesch, United States
,Jamal McDermott, United States
,Zion Kohler, United States
,Drew Ankunding, United States
,Ms. Nya King, United States
,Porter Tremblay,USA
,Alexis Osinski,USA
,Jovani Abshire,USA
,Lisette Spencer,USA
,Anna Swaniawski, United States
,Heaven Pfannerstill, United States
,Henry Schoen, United States
,Cristal Raynor MD, United States
,Mrs. Lavada Metz, United States
,Wade Leuschke, United States
,Randi Wolff, United States
,Albertha Pacocha, United States
,Georgette Williamson, United States
,Sally Rau, United States
,Brock Bednar, United States
,Oliver Wiegand, United States
,Shaylee Schneider V, United States
,Morton Heidenreich, United States
,Rasheed Lebsack, United States
,Sherman Towne, United States
,Ms. Deon Bartell, United States
,Brown Bayer, United States
,Virginie Wisoky, United States
,Wilbert Prohaska, United States
,Rosina Prosacco V, United States
,Jeremie Fritsch, United States
,Raoul Ondricka, United States
,Johnathon Ernser, United States
,Shaylee Koepp, United States
,Eladio Little PhD, United States
,Aniyah Murphy V, United States
,Miss Odell Pollich, United States
,Mrs. Makenna Kirlin, United States
,Evan Corwin, United States
,Mozelle Stehr, United States
,Santina Littel, United States
,Madyson Maggio, United States
,Brayan Barton, United States
,Dandre Harªann, United States
,Bria Kohler, United States
,Jaiden Jast, United States
,Nikki Goyette, United States
,Korbin Upton III, United States
,Jerrold Baumbach, United States
,Jamison Ledner, United States
,Mariane Kemmer DVM, United States
,Adolphus Dicki, United States
,Ericka Harber, United States
,Kylee Mohr, United States
,Ladarius Terry, United States
,Luisa Altenwerth II, United States
,Chasity Dooley, United States
,Mr. Regan Price, United States
,Itzel Wuckert, United States
,Deondre Mann, United States
,Delphine Ullrich IV, United States
,Marvin Walker, United States
,Devin Mann, United States
,Rogers Botsford,USA
,Webster Kling,USA
,Mandy Fadel II, United States
,Garry Stracke, United States
,Adalberto Pacocha, United States
,Cordia Abbott, United States
,Jaime Metz, United States
,Moses O'Reilly V, United States
,Neha Turner, United States
,Ara Monahan II, United States
,Nadia Mohr, United States
,Jennifer Ward II, United States
,Faye Rowe, United States
,Herbert Eichmann, United States
,Mr. Violet Maggio, United States
,Madie Moore, United States
,Geovanni Bradtke, United States
,Candice Becker, United States
,Miss Clark Bechtelar, United States
,Libby Bahringer, United States
,Miss Heather Waelchi, United States
,Alessandro Daugherty, United States
,Rigoberto Prosacco, United States
,Damian Williamson, United States
,Eloisa O'Conner, United States
,Gilberto Littel, United States
,Miss Annalise Marvin, United States
,Austyn Deckow MD, United States
,Cory Crist, United States
,Leonard Satterfield, United States
,Audra Kilback, United States
,Evan Koch DDS,USA
,Karley West, United States
,Oceane McLaughlin, United States
,Litzy O'Hara, United States
,Jermaine Conroy, United States
,Dr. Hobart Nolan,USA
,Anderson Franecki, United States
,Ms. Kylie Daniel, United States
,Mr. Furman Padberg, United States
,Ethyl Langworth, United States
,Suzanne Boyle, United States
,Lottie Orn, United States
,Garnett Greenfelder, United States
,Devyn Schmidt, United States
,Nicolette Pfeffer,USA
,Maude Botsford, United States
,Ansley Hettinger, United States
,Enrique Stroman, United States
,Erica Langworth MD, United States
,Mekhi Renner, United States
,Ms. Justus Schmitt, United States
,Mrs. Jennifer McCullough, United States
,Aileen Crona,USA
,Zackary Upton, United States
,Lucinda Vandervort, United States
,Larissa Lind II, United States
,Mason Crona, United States
,Cyril Powlowski, United States
,Tressa Schiller, United States
,Deanna Lemke,USA
,Waylon Schumm III, United States
,Miss Ole Zboncak, United States
,Mrs. Emanuel Jacobson, United States
,Eusebio Wiegand, United States
,Jasper Doyle, United States
,Zachariah Hickle, United States
,Lonie Waters, United States
,Heber Romaguera,USA
,Lavina Cummings, United States
,Elise Hermiston, United States
,Jolie Dickinson, United States
,Jaydon Gleason, United States
,Albert Dach, United States
,Sam Gibson, United States
,Dr. Ronaldo Carroll, United States
,Nathanial Klein, United States
,Mozelle Schulist II, United States
,Kitty Torphy, United States
,Lyda Deckow, United States
,Lexi Hirthe, United States
,Seamus Sauer, United States
,Ramon Hane Jr., United States
,Mr. Tommie Terry, United States
,Jana Wilderman, United States
,Hayley Gislason, United States
,Jaleel Walker IV, United States
,Palma Stehr, United States
,Dorris Dicki, United States
,Omer Pfeffer, United States
,Stephen Reilly, United States
,Houston Blanda, United States
,Dr. Domenic Stroman,USA
,Julia Lehner, United States
,Meda Moen, United States
,Clair Waelchi, United States
,Brooks Hane, United States
,Ms. Kareem Koss, United States
,Uriel Rowe,USA
,Kristy Cummings,USA
,Evangeline Mosciski,USA
,Jared Stehr PhD,USA
,Jerad Davis Sr., United States
,Hilton Wunsch V, United States
,Logan Crooks, United States
,Mrs. Tessie Jewess, United States
,Rolando McDermott, United States
,Royal Gleason, United States
,Kali Herzog, United States
,Camylle Borer, United States
,Irving Paucek, United States
,Dr. Macy Borer, United States
,Dock Huel, United States
,Pauline Raynor MD, United States
,Wendell Jewess, United States
,Octavia Legros, United States
,Anastacio Koelpin, United States
,Nestor Jacobi, United States
,Brisa Kub, United States
,Favian Kozey, United States
,Ms. Aubree Osinski, United States
,Mr. Pasquale Runolfsson, United States
,Cyrus Lockman, United States
,Derrick Rohan IV, United States
,Miss Leland Cremin, United States
,Marianne Cole, United States
,Jettie Runolfsdottir, United States
,Laurine Schimmel V, United States
,Chester Bergnaum, United States
,Mrs. Ambrose Harªann, United States
,Art Thompson PhD, United States
,Kayden Bins, United States
,Johanna Daniel, United States
,Dr. Maye Strosin, United States
,Allene Huels, United States
,Jade Harªann, United States
,Braden Murray Sr., United States
,Brant Nader, United States
,Savanah Nader, United States
,Ariane Kuhn, United States
,Beatrice Howell, United States
,Mrs. Barrett Mitchell, United States
,Miss Leora Streich, United States
,Rosanna Satterfield, United States
,Deja Jacobs, United States
,Lelah Brekke MD, United States
,Sabrina Gerhold, United States
,Kole Treutel, United States
,Charlene Maggio, United States
,Alessandra Effertz, United States
,Ms. Una Roberts, United States
,Lon Wilderman, United States
,Dr. Jessyca Ebert, United States
,Fae Wilkinson, United States
,Citlalli Stroman, United States
,Dr. Raymundo Labadie, United States
,Lee Deckow,USA
,Baby Douglas,USA
,Ubaldo Halvorson, United States
,Camron Schumm, United States
,Arnoldo Stiedemann, United States
,Dr. Guiseppe Wintheiser, United States
,Mrs. Hyman Keeling, United States
,Kevon Mante, United States
,Hosea Reilly, United States
,Norval Schuppe, United States
,Helmer Rowe, United States
,Dr. Elsie Heaney, United States
,Janessa Torphy, United States
,Bessie Brown, United States
,Darby Dach, United States
,Victoria Durgan, United States
,Marco Sipes, United States
,Lawrence Hauck, United States
,Constantin Kuphal, United States
,Lorenzo Ledner, United States
,Sean Bauch II, United States
,Colten Hamill, United States
,Brent Nienow Sr., United States
,Elton Wisoky II, United States
,Dr. Rebecca West, United States
,Diego Pollich, United States
,Mr. Lucy Becker, United States
,Stephanie Gleason, United States
,Zoie Nitzsche, United States
,Marquis Harªann, United States
,Elyse Wilderman, United States
,Ezequiel Altenwerth,USA
,Meaghan Swift, United States
,Clementina Gutkowski, United States
,Aric Cronin, United States
,Stan Murazik, United States
,Maiya Beier,USA
,Brionna Nitzsche, United States
,Tyrese Pfeffer, United States
,Ernestina Labadie, United States
,David Runte, United States
,Clovis Reichel, United States
,Jammie Schamberger MD, United States
,Ezequiel Haag, United States
,Aubrey Turcotte, United States
,Abner Murray,USA
,Rosetta Gibson, United States
,Salma Moore, United States
,Selmer Oberbrunner, United States
,Shad Cronin, United States
,Kaylee Bauch, United States
,Bailey Johnson, United States
,Aida Ziemann, United States
,Miss Jalen Torp,USA
,Velva Schroeder, United States
,Lesley Kautzer, United States
,Miss Jena Barton, United States
,Ofelia Shields, United States
,Aimee Reynolds, United States
,Mavis Johnston, United States
,Hermina King,USA
,Maximillian Brown, United States
,Lexi Ebert I, United States
,Griffin Barrows, United States
,Augustine Hammes, United States
,Tia Huels, United States
,Aryanna Labadie, United States
,Jessika Langworth, United States
,Percival Steuber,USA
,Travis Ward III, United States
,Delfina Schmidt, United States
,Dr. Cortez Mraz, United States
,Craig Homenick, United States
,Adriana Torp PhD, United States
,Kaitlyn Padberg, United States
,Mrs. Raphaelle Lind, United States
,Nella Dibbert, United States
,Mr. Annamae Cremin, United States
,Miss Xander Nader, United States
,Sandra Schoen, United States
,Daphne Stroman, United States
,Alden Tillman, United States
,Ms. Ayla Hegmann, United States
,Elody Abbott V, United States
,Fleta Ryan, United States
,Anne Fadel, United States
,Mrs. Melvin Skiles, United States
,Jeffery Kemmer IV, United States
,Jodie Klocko, United States
,Adaline Turner IV, United States
,Ms. Sydney Hyatt, United States
,Nicholaus Funk, United States
,Elbert Auer,USA
,Mrs. Roman Reichel, United States
,Garfield Cremin, United States
,Jermain Okuneva Sr., United States
,Lane Stehr V, United States
,Oswald Baumbach, United States
,Malika Stracke,USA
,Carlos Hoppe,USA
,Lina Carter,USA
,Tate Reynolds,USA
,Alexandre Lehner, United States
,Raven Metz II, United States
,Emerald Bauch, United States
,Miss Dortha Gislason, United States
,Mr. Cristobal Crona, United States
,Antonietta Runte, United States
,Rae Bechtelar, United States
,Weldon Ledner, United States
,Alfreda Shanahan, United States
,Pattie Kemmer, United States
,Evangeline Aufderhar, United States
,Mrs. Jaclyn Runte, United States
,Avery Funk, United States
,Dr. Nelle Botsford, United States
,Enos Conroy MD, United States
,Deborah Kertzmann, United States
,Constance Koss III, United States
,Dr. Shirley Hermann, United States
,Erik Frami, United States
,Caden Cummings I, United States
,Kaci Swift, United States
,Anibal Keeling, United States
,Chelsea Connelly, United States
,Emilia Douglas Sr., United States
,Franz Bashirian, United States
,Keely Kemmer, United States
,Martine Haag, United States
,Alejandrin Koch, United States
,Sage Murray, United States
,Woodrow Rolfson, United States
,Derick Cruickshank, United States
,Nayeli Bruen, United States
,Elenora Kerluke, United States
,Liza Ullrich, United States
,Sadie Greenfelder, United States
,Sydney Macejkovic, United States
,Aileen Grant, United States
,Ole Steuber, United States
,Rodolfo Smith, United States
,Donato Reichert, United States
,Linda Weber, United States
,Destini Lubowitz, United States
,Elinor Lakin, United States
,Elbert Rempel, United States
,Esperanza O'Kon V, United States
,Emmalee Batz, United States
,Elsie Krajcik, United States
,Malvina Larson, United States
,Cecilia Schumm, United States
,Angeline Conroy, United States
,Keegan Konopelski, United States
,Bennie Labadie, United States
,Melyna Schimmel II, United States
,Marjorie Gibson, United States
,Rowena Morar,USA
,Sibyl Kutch,USA
,Troy Brekke, United States
,Dr. Dulce Smitham, United States
,Quinton Cormier, United States
,Karianne Denesik V, United States
,Nicklaus Will, United States
,Miss Maximillian Gibson, United States
,Eudora Koss, United States
,Herman Gislason, United States
,Vivian Schiller, United States
,Jerrold Hayes, United States
,Jeffry Heidenreich, United States
,Harmon Purdy, United States
,Otis Rosenbaum, United States
,Edna Corwin, United States
,Alexys Herman, United States
,Jaycee Hickle, United States
,Jaeden Huels, United States
,Shanel Konopelski, United States
,Jovani Hyatt, United States
,Marielle Wisoky, United States
,Zack Gleichner, United States
,Delfina Mosciski, United States
,Raegan Dickinson, United States
,Chelsie Powlowski, United States
,Gerhard Littel, United States
,Aleen Altenwerth, United States
,Glen Leannon PhD, United States
,Josefina Abernathy, United States
,Alexandrine Schinner, United States
,Electa McClure,USA
,Anderson Huel, United States
,Zakary Cronin, United States
,Victoria Goodwin, United States
,Brady Pouros, United States
,Hipolito Rolfson,USA
,Jamie Powlowski, United States
,Lamar Harªann, United States
,Mrs. Rachelle Sawayn, United States
,Hettie Thompson, United States
,Miss Roscoe Gusikowski, United States
,Genevieve Kunze, United States
,Chaya Sipes, United States
,Erna Mueller MD, United States
,Cecilia Harªann PhD,USA
,Landen Collier, United States
,Lilian Monahan, United States
,Dora Gorczany, United States
,Ms. Eleanora Kunde, United States
,Dashawn Blick, United States
,Nicholas Batz, United States
,Zul Cartwright DDS, United States
,Laura Auer,USA
,Ocie McKenzie, United States
,Izabella Pagac, United States
,Helena Kreiger, United States
,Danial Champlin DDS, United States
,Miss Benny Aufderhar, United States
,Ransom Ryan, United States
,Keeley Denesik II,USA
,Tiara Nader, United States
,Juliana Block III, United States
,Cheyenne Hudson, United States
,Trycia Rowe, United States
,Consuelo Morar, United States
,Richmond Anderson Jr., United States
,Alisha Ward, United States
,Melvina Parisian,USA
,Caitlyn Hand, United States
,Darlene Rau, United States
,Dr. Bonita Becker, United States
,Henry O'Reilly, United States
,Lelah Harris, United States
,Ambrose Kemmer, United States
,Leslie Volkman, United States
,Miss Sylvan Raynor, United States
,Natalie Lind, United States
,Bertram Schultz, United States
,Mrs. Roderick Haley, United States
,Matilda Marvin, United States
,Yvonne Veum, United States
,Maymie Donnelly Jr., United States
,Ivory Dietrich, United States
,Nigel Kris MD, United States
,Rasheed Heaney II, United States
,Chris Welch V, United States
,Miss Salma Jacobson, United States
,Jessika Shields, United States
,Braulio Schmitt, United States
,Kylee Klein, United States
,Dewayne Borer, United States
,Tyler Kuhn,USA
,Kylee Orn, United States
,Camren Hyatt, United States
,Eulah Price, United States
,Lois Mitchell, United States
,Cora Cremin, United States
,Ebba Shanahan,USA
,Aidan Schmidt,USA
,Talia Hand,USA
,Giles Daugherty I,USA
,Emily Kuhn III, United States
,Dawson Sipes, United States
,Lazaro Stroman, United States
,Mr. Shaina Daugherty, United States
,Ivy Watsica, United States
,Beatrice Fahey I, United States
,Jalen Jewess, United States
,Luella Gutkowski II, United States
,Dr. Caroline Rath, United States
,Deion Bashirian, United States
,Madeline Connelly, United States
,Jonathan Mayert, United States
,Mr. Roel Harris, United States
,Junior Welch IV, United States
,Hyman Ullrich, United States
,Maegan Borer PhD, United States
,Alec Marquardt, United States
,Torrey Rempel, United States
,Allie Bechtelar, United States
,Nicolas O'Connell, United States
,Asa Grimes, United States
,Oscar Beahan, United States
,Mrs. Brian Rosenbaum, United States
,Aurelia Lockman, United States
,Herman Kulas, United States
,Jules McDermott, United States
,Ms. Ansel McGlynn, United States
,Shanelle Yost, United States
,Hadley Corkery, United States
,Caesar Kling, United States
,Lane Hirthe II, United States
,Magdalen McGlynn, United States
,Olga Kunde, United States
,Electa Oberbrunner, United States
,Jalyn Hane, United States
,Chyna Kulas, United States
,Presley Harris IV, United States
,Kathleen Harªann, United States
,Cristina Reichert, United States
,Emmalee Marvin, United States
,Darlene Labadie, United States
,Jovani Kohler, United States
,Bart Lakin, United States
,Bailee Nikolaus, United States
,Hulda Beahan DDS, United States
,Dario Cruickshank, United States
,Virgil Durgan, United States
,Ms. Troy Abshire, United States
,Halie Legros, United States
,Rafaela Simonis DVM, United States
,Libby Balistreri, United States
,Walker Kuhic, United States
,Westley Durgan, United States
,Gwen Harªann V, United States
,Jovanny Barton,USA
,Greta Corwin,USA
,Dr. Floyd Rogahn, United States
,Megane Lesch, United States
,Michale Greenfelder, United States
,Jeromy Cremin, United States
,Neil Kuphal, United States
,Dillon Larkin, United States
,Anais Roberts, United States
,Jeanie Treutel, United States
,Dr. Christy Kerluke, United States
,Mr. Loyce Simonis, United States
,Bulah Kertzmann, United States
,Kaylee Conroy II, United States
,Jamarcus Mills, United States
,Emory Hamill V, United States
,Nigel Hammes III, United States
,Davonte Mayert, United States
,Velva Feil, United States
,Chris Prohaska, United States
,Dolly Jacobson, United States
,Reilly Langosh Jr., United States
,Roselyn Quigley, United States
,Blaze Wilkinson, United States
,Mrs. Annabelle Prohaska,USA
,Trisha Heidenreich, United States
,Cody Carter, United States
,Elian Franecki DDS, United States
,Dayna Marvin, United States
,Andrew Effertz, United States
,Monserrate Torp, United States
,Rory Boyer, United States
,Patsy Rath, United States
,Vita Wolff II, United States
,Miss Pat Kuhlman, United States
,Lulu Treutel, United States
,Maxie Harber, United States
,Cynthia Huel, United States
,Rodger Legros, United States
,Mrs. Melyna Dare, United States
,Eusebio Kris, United States
,Jerry Bradtke, United States
,Mrs. Jedediah Hills, United States
,Filomena Marvin, United States
,Oswaldo Heller, United States
,Pansy Renner, United States
,Coralie Daniel, United States
,Miss Esta Spencer, United States
,Camren Jones, United States
,Kamren Dickens, United States
,Wendy Turner, United States
,Mrs. Kylee Rolfson, United States
,Giovanni Yundt,USA
,Leonora Rempel, United States
,Stephan Farrell Sr., United States
,Lucy Lesch, United States
,Alta Lemke Jr., United States
,Oceane Prosacco, United States
,Judd Bode, United States
,Dusty Harris, United States
,Mia Oberbrunner, United States
,Hattie Hoppe IV, United States
,Garett Dooley, United States
,Willie Dickinson, United States
