 User id,Name,Country
,Sharon Marvin IV, United States
,Elisabeth Rice, United States
,Elwin Boyle, United States
,Kade Bashirian, United States
,Zita Mosciski, United States
,Jesse Ebert, United States
,Markus Grady, United States
,Oswaldo Rice, United States
,Alec Cummings, United States
,Dr. Grace Swift, United States
,Peyton Zieme, United States
,Dawn Mitchell Jr., United States
,Ms. Alexane Runte, United States
,Leif Bruen, United States
,Ms. Scottie Jacobi, United States
,Bennett Mosciski, United States
,Haley Metz,USA
,Maynard Kuphal, United States
,Kristin Sawayn, United States
,Brenden Kessler, United States
,Edna Wilkinson, United States
,Meta Stanton DDS, United States
,Brenden Toy DVM, United States
,Lambert Carroll,USA
,Gwendolyn Paucek, United States
,Hope Legros, United States
,Abelardo McCullough, United States
,Erling McCullough, United States
,Janis Howell DDS,USA
,Mr. Jaeden Daugherty, United States
,Savanah Collier, United States
,Marcelo Orn, United States
,Torey Toy, United States
,Hal Gerlach, United States
,Noelia Streich, United States
,Carmel Hickle, United States
,Kelvin Ebert, United States
,Aurore Parisian,USA
,Johnnie Goyette, United States
,Chandler Brekke, United States
,Geovany Lockman, United States
,Cassie Konopelski, United States
,Mr. Kirsten Wintheiser, United States
,Kenyon Breitenberg, United States
,Aida Grady, United States
,Miss Lois Hackett,USA
,Bernardo Hills, United States
,Leonie Turcotte, United States
,Eunice Bayer, United States
,Jesus Altenwerth, United States
,Curt Towne, United States
,Mrs. Lionel Lynch, United States
,Mr. Wade Ziemann,USA
,Kyra Prosacco, United States
,Junius Hand, United States
,Miss Bret Klein, United States
,Cullen Dietrich,
,Maximillia Schroeder,
,Mr. Angeline Hessel,
,Samir Schumm,
,Michele Walter,
,Miss Flo Howell,
,Westley Moore,
,Otho Kozey, United States
,Larissa Harris,USA
,Elroy Wuckert, United States
,Betsy Dooley, United States
,Ms. Susie Hayes, United States
,Mrs. Providenci Torphy, United States
,Yasmine Schiller MD,USA
,Vesta McLaughlin, United States
,Drew Pouros Jr., United States
,Miss Salvador Hoeger, United States
,Mrs. Shannon Bogisich, United States
,Damaris Moen, United States
,Idell Padberg DDS, United States
,Adelbert O'Kon, United States
,Isabella McDermott, United States
,Vivianne Lesch,USA
,Alda Dach, United States
,Kip Toy, United States
,Ford Emmerich DVM, United States
,Audra Bernhard, United States
,Trevor Blanda, United States
,Tania Casper, United States
,Dr. Schuyler Quitzon, United States
,Hailie Koch,USA
,America Altenwerth, United States
,Elliot Steuber, United States
,Mrs. Oliver Gaylord, United States
,Ricky Romaguera, United States
,Oran Mayert, United States
,Jillian Doyle MD, United States
,Marcelina Feest,USA
,Marcellus Champlin, United States
,Cyrus Rosenbaum, United States
,Lea Moen IV, United States
,Mr. Karelle Schinner, United States
,Devan Kuvalis, United States
,Grover Yundt, United States
,Telly Maggio V, United States
,Lysanne Schulist, United States
,Edwin Klocko, United States
,Major Bechtelar II, United States
,Isai Bailey, United States
,Gilda Flatley, United States
,Mohammed Deckow Sr., United States
,Perry Nolan III, United States
,Jordan Spinka, United States
,Carey Schaefer, United States
,Idella Hickle, United States
,Letitia Schowalter Jr., United States
,Tania Sawayn, United States
,Mrs. Hilbert Boyle, United States
,Marcelle Block, United States
,Name Mraz, United States
,Clint Heaney, United States
,Alexys Zboncak, United States
,Tierra Wehner, United States
,Marcelino Beer, United States
,Carole Lemke, United States
,Tatyana Gutkowski, United States
,Coy Smith, United States
,Lina Gerlach, United States
,Anibal Cremin, United States
,Rhett Spencer, United States
,Effie Cormier, United States
,Bernie Grant, United States
,Faustino Stiedemann, United States
,William Ledner III, United States
,Christa Crona, United States
,Floyd Murphy II, United States
,Sammie Lesch DVM, United States
,Stephon Powlowski, United States
,Rowland Douglas, United States
,Eunice Bruen, United States
,Reilly Luettgen, United States
,Barry Nienow, United States
,Mose Collier III, United States
,Kaylee Schneider, United States
,Tatum Spencer, United States
,Delilah Jerde, United States
,Mr. Alvena Herzog, United States
,Miss Marge O'Conner, United States
,Virginia Jenkins I, United States
,Ms. Benny Durgan, United States
,Mr. Treva Stoltenberg, United States
,Sheldon Kautzer, United States
,Kenyon Bashirian, United States
,Kattie Kreiger, United States
,Josefa Batz, United States
,Myrl Homenick, United States
,Susie Orn, United States
,Schuyler Shields, United States
,Stan Dietrich, United States
,Cleve Donnelly, United States
,Caitlyn Schoen, United States
,Justyn Heathcote, United States